{
  "$schema": "./ai-governance-protocol.schema.json",
  "protocolId": "ai-governance-protocol",
  "protocolVersion": "1.1.0",
  "status": "active",
  "purpose": "A generic, machine-readable governance protocol for AI engineering agents. It governs authority discovery, state classification, change evaluation, evidence, promotion and release claims without replacing project-specific runtime or domain contracts.",
  "normativeTerms": {
    "MUST": "required",
    "MUST_NOT": "prohibited",
    "SHOULD": "recommended unless justified otherwise",
    "SHOULD_NOT": "normally prohibited unless justified otherwise",
    "MAY": "optional",
    "PASS": "observed success only"
  },
  "authorityHierarchy": [
    {
      "rank": 1,
      "kind": "executable",
      "includes": [
        "schemas",
        "types",
        "contracts",
        "behavioral_tests",
        "capability_enforcement"
      ],
      "currentRuntimeAuthority": true
    },
    {
      "rank": 2,
      "kind": "active_component_contract",
      "currentRuntimeAuthority": true
    },
    {
      "rank": 3,
      "kind": "cross_component_ownership_and_lifecycle",
      "currentRuntimeAuthority": true
    },
    {
      "rank": 4,
      "kind": "operational_guidance",
      "currentRuntimeAuthority": false
    },
    {
      "rank": 5,
      "kind": "adr_and_history",
      "currentRuntimeAuthority": false
    }
  ],
  "conflictResolution": {
    "steps": [
      "determine_whether_each_source_is_active",
      "discard_superseded_or_historical_sources_for_current_behavior",
      "prefer_lower_numeric_authority_rank",
      "record_governance_drift_for_lower_rank_conflicts",
      "stop_on_equal_rank_active_canonical_conflict"
    ],
    "blockingStatus": "BLOCKED_AUTHORITY_CONFLICT"
  },
  "stateClasses": {
    "source": {
      "definition": "External, user-authored, or repository-authored canonical input.",
      "maySelfPromote": false
    },
    "decision": {
      "definition": "Durable reviewed human, compatibility, dependency, or governance decision constraining future rebuilds.",
      "maySelfPromote": false,
      "survivesDerivedRebuild": true
    },
    "derived": {
      "definition": "Reproducible materialization from higher-authority inputs.",
      "maySelfPromote": false
    },
    "projection": {
      "definition": "Denormalized search, UI, report, index, or current-state representation that must never become edit-back authority by itself.",
      "maySelfPromote": false
    },
    "evidence": {
      "definition": "Diagnostic, experimental, qualification, verification, acceptance, artifact, or audit material.",
      "maySelfPromote": false,
      "promotionAuthority": false
    }
  },
  "coreInvariants": [
    {
      "id": "GOV-01",
      "level": "MUST",
      "rule": "For each governed state there is exactly one active authority chain and permitted writer; a current-state registry is a projection and must not become runtime authority unless a project profile explicitly declares otherwise."
    },
    {
      "id": "GOV-02",
      "level": "MUST",
      "rule": "Every authoritative durable state class has exactly one permitted writer or writer capability."
    },
    {
      "id": "GOV-03",
      "level": "MUST",
      "rule": "Source, decision, derived, projection, and evidence state are classified distinctly."
    },
    {
      "id": "GOV-04",
      "level": "MUST_NOT",
      "rule": "Derived, projection, or evidence state must self-promote into source or decision authority."
    },
    {
      "id": "GOV-05",
      "level": "MUST",
      "rule": "Durable human or compatibility decisions survive rebuild unless explicitly changed through their permitted writer."
    },
    {
      "id": "GOV-06",
      "level": "MUST",
      "rule": "Evidence proves only the exact subject identity to which it is bound."
    },
    {
      "id": "GOV-07",
      "level": "MUST",
      "rule": "A change to any declared evidence identity input invalidates dependent evidence for the new subject while retaining old evidence as history."
    },
    {
      "id": "GOV-08",
      "level": "MUST_NOT",
      "rule": "Diagnostic, shadow, or candidate evidence must automatically activate production behavior."
    },
    {
      "id": "GOV-09",
      "level": "MUST",
      "rule": "Destructive or externally visible mutation uses identity preflight, bounded impact, stale-state protection, sole-writer mutation, verification, and recoverability or audit evidence."
    },
    {
      "id": "GOV-10",
      "level": "MUST",
      "rule": "Strict acceptance verifies the exact subject identity it claims to accept; artifact verification observes existing artifact bytes without rebuilding, and any rebuild creates a new subject identity requiring new acceptance."
    },
    {
      "id": "GOV-11",
      "level": "MUST_NOT",
      "rule": "Missing, unavailable, skipped, inferred, or stale required evidence must be reported as PASS."
    },
    {
      "id": "GOV-12",
      "level": "MUST_NOT",
      "rule": "Historical documents or ADRs must override active runtime contracts."
    },
    {
      "id": "GOV-13",
      "level": "MUST",
      "rule": "Retryable mutation declares idempotence; non-idempotent retry requires establishing prior-operation state."
    },
    {
      "id": "GOV-14",
      "level": "MUST",
      "rule": "Lifecycle claims become stronger only when their declared prerequisites are evidenced for the same subject identity."
    },
    {
      "id": "GOV-15",
      "level": "MUST",
      "rule": "Verification gates declare their side-effect policy; a gate must not perform undeclared external or authoritative mutation."
    },
    {
      "id": "GOV-16",
      "level": "MUST",
      "rule": "Missing reproducibility identity blocks promotion to lifecycle states that require it, but does not block a scoped repair whose declared purpose is to establish that identity."
    }
  ],
  "ownershipContractRequiredFields": [
    "stateId",
    "stateClass",
    "owner",
    "permittedWriter",
    "readers",
    "sourceInputs",
    "invalidationTriggers",
    "failureBehavior",
    "forbiddenWriters",
    "mutationPolicy",
    "approvalPolicy"
  ],
  "activeComponentContractRequiredFields": [
    "role",
    "scope",
    "authority",
    "reads",
    "writes",
    "mustNotWrite",
    "stateTransitions",
    "failureSemantics",
    "dependencies",
    "tests"
  ],
  "approvalPolicies": [
    "none",
    "explicit_agent_capability",
    "human_required",
    "external_system_required"
  ],
  "subjectIdentity": {
    "requiredFields": [
      "identityRef",
      "projectId",
      "artifactType",
      "sourceIdentity",
      "dependencyIdentity",
      "contractSetIdentity",
      "schemaIdentities"
    ],
    "nullableUntilPromotionFields": [
      "dependencyIdentity",
      "toolchainIdentity",
      "runtimeIdentity",
      "artifactIdentity"
    ],
    "optionalFields": [
      "baseVersion",
      "baseIdentity",
      "toolchainIdentity",
      "runtimeIdentity",
      "resourceIdentities",
      "modelIdentities",
      "artifactIdentity"
    ],
    "artifactTypeAuthority": "project_profile",
    "rule": "All gate and evidence records reference the exact subject identity they validate. A required field may be explicitly null only where the project profile permits repair before promotion; null never satisfies a promotion prerequisite."
  },
  "evidence": {
    "requiredFields": [
      "evidenceId",
      "stage",
      "proofClass",
      "producer",
      "subjectIdentityRef",
      "observedAt",
      "result",
      "promotionAuthority"
    ],
    "stages": [
      "diagnostic",
      "shadow",
      "qualification",
      "fast_gate",
      "strict_acceptance",
      "artifact_verification",
      "audit"
    ],
    "proofClasses": [
      "lint",
      "structural",
      "behavioral",
      "acceptance"
    ],
    "resultValues": [
      "PASS",
      "FAIL",
      "SKIPPED",
      "UNAVAILABLE",
      "NOT_RUN",
      "STALE_FOR_CURRENT_SUBJECT"
    ],
    "invalidationRule": "If any declared identity input changes, evidence remains historical but becomes STALE_FOR_CURRENT_SUBJECT for the changed subject.",
    "promotionRule": "Evidence stage and proof class are independent dimensions. Only observed evidence satisfying the project profile's required proof class and gate profile may support promotion."
  },
  "claimSemantics": {
    "evidenceStatus": [
      "observed",
      "inferred",
      "unavailable"
    ],
    "verificationStatus": [
      "verified",
      "not_verified",
      "failed"
    ],
    "workflowStatus": [
      "complete",
      "blocked",
      "planned"
    ],
    "rule": "Only observed evidence for the same subject may satisfy an executable gate requirement. Inferred, unavailable, skipped, stale, or not-run evidence cannot be upgraded to PASS."
  },
  "executionAlgorithm": [
    {
      "step": "A0",
      "name": "discover_authority",
      "actions": [
        "load_project_profile",
        "load_active_runtime_contracts",
        "load_state_ownership",
        "load_gate_definitions",
        "regenerate_or_verify_current_state_projection",
        "consult_history_only_for_rationale"
      ]
    },
    {
      "step": "A1",
      "name": "establish_subject_identity",
      "actions": [
        "resolve_project_identity",
        "resolve_artifact_type_from_project_profile",
        "resolve_source_identity",
        "resolve_dependency_identity_or_record_null",
        "resolve_contract_set_identity",
        "resolve_schema_identities",
        "resolve_base_identity_when_applicable"
      ]
    },
    {
      "step": "A2",
      "name": "evaluate_change",
      "actions": [
        "define_in_scope",
        "define_out_of_scope",
        "classify_affected_state",
        "record_structured_authority_changes",
        "identify_invalidations",
        "identify_required_gate_profile",